{
  "$schema": "../schemas/alarm_detectors.schema.json",
  "schemaVersion": 1,
  "verified": false,
  "notes": [
    "Модели для выбора в alarm.zones[].model; без выбора берётся первая модель нужного типа с замечанием. Радиус зоны контроля и высота помещения — по СП 484 (data/norms/sp484), не по паспорту.",
    "Токи — «не более» по РЭ, одинаковы для дежурного режима и «Пожара»: отдельного тока в тревоге паспорта Болид не дают. Встроенных изоляторов КЗ у базовых моделей нет — п. 6.3.5 СП 484 обеспечивается БРИЗ исп.03 (база под ИП) или исполнениями с ИКЗ.",
    "Поле certificate заполняется по сертификату, действующему в КР (А-12); пустое поле даёт предупреждение расчёта.",
    "Сертификаты — по сканам с bolid.ru и сводному списку sertif_table_may_26.pdf; номера в реестрах ЕЭК/Росаккредитации не проверены. Признание в КР — вопрос А-12."
  ],
  "detectors": [
    {
      "id": "bolid.dip34a_03",
      "kind": "smoke",
      "name": "ДИП-34А-03",
      "designation": "ИП 212-34А",
      "manufacturer": "НВП «Болид»",
      "loopCurrent": 0.0006,
      "addresses": 1,
      "isolator": false,
      "source": "РЭ АЦДР.425232.002-03 РЭп, изм. 14 от 27.07.2026, пп. 1.2.1–1.2.3, с. 6 (bolid.ru/files/373/566/dip_34a_03_rep_avg_2026.pdf)",
      "note": "Чувствительность 0,05…0,2 дБ/м (п. 1.2.7); тип входа КДЛ 21 «Пожарный».",
      "certificate": "Сертификат ТР ЕАЭС 043/2017 ЕАЭС RU С-RU.ПБ68.В.01396/22, ОС ООО «ПСК» (РОСС RU.0001.11ПБ68), 13.12.2022–12.12.2027 (bolid.ru/files/373/566/ss_tr_01396_22.pdf); сверить в реестре ЕЭК"
    },
    {
      "id": "bolid.s2000_ip_03",
      "kind": "heat",
      "name": "С2000-ИП-03",
      "designation": "ИП 101-55-A1R",
      "manufacturer": "НВП «Болид»",
      "loopCurrent": 0.0006,
      "addresses": 1,
      "isolator": false,
      "heatClass": "A1R",
      "responseTemperature": 54,
      "source": "РЭ АЦДР.425214.002-03 РЭп, изм. 14 от 26.01.2026, пп. 1.2.1–1.2.3, 1.2.7–1.2.9, с. 6 (bolid.ru/files/373/566/s2000_ip_03_rep_jan_2026.pdf)",
      "certificate": "Сертификат ТР ЕАЭС 043/2017 ЕАЭС RU С-RU.ПБ68.В.01396/22, ОС ООО «ПСК» (РОСС RU.0001.11ПБ68), 13.12.2022–12.12.2027 (bolid.ru/files/373/566/ss_tr_01396_22.pdf); сверить в реестре ЕЭК"
    },
    {
      "id": "bolid.ipr513_3am",
      "kind": "manual",
      "name": "ИПР 513-3АМ",
      "designation": "ИПР 513-3АМ",
      "manufacturer": "НВП «Болид»",
      "loopCurrent": 0.0004,
      "addresses": 1,
      "isolator": false,
      "source": "РЭ АЦДР.425211.004 РЭп, изм. 09 от 13.01.2026, п. 1.2.2, с. 6 (bolid.ru/files/373/566/ipr_513_3am_rep_jan_2026.pdf): 0,4 мА для ПО от 1.20 (0,5 мА для ПО до 1.07)",
      "certificate": "Сертификат ТР ЕАЭС 043/2017 ЕАЭС RU С-RU.ПБ68.В.01396/22, ОС ООО «ПСК» (РОСС RU.0001.11ПБ68), 13.12.2022–12.12.2027 (bolid.ru/files/373/566/ss_tr_01396_22.pdf); сверить в реестре ЕЭК"
    },
    {
      "id": "bolid.ipr513_3am_01_ip67",
      "kind": "manual",
      "name": "ИПР 513-3АМ исп.01 IP67",
      "designation": "ИПР 513-3АМ исп.01",
      "manufacturer": "НВП «Болид»",
      "loopCurrent": 0.0006,
      "addresses": 1,
      "isolator": true,
      "source": "РЭ АЦДР.425211.012-01 РЭп, изм. 09 от 11.08.2025, пп. 1.2.2, 1.2.5, с. 6 (bolid.ru/files/373/566/ipr_513_3am_01_IP67_rept_aug_25.pdf); ток при сработавшем ИКЗ (п. 1.2.3) — сверить по PDF",
      "certificate": "Сертификат ТР ЕАЭС 043/2017 ЕАЭС RU С-RU.ПБ68.В.01396/22, ОС ООО «ПСК» (РОСС RU.0001.11ПБ68), 13.12.2022–12.12.2027 (bolid.ru/files/373/566/ss_tr_01396_22.pdf); сверить в реестре ЕЭК"
    }
  ]
}
